{
    "$schema":  "../schema/intake-batch.schema.json",
    "schema_version":  "crossref-verification-v2-intake-batch",
    "batch_id":  "intake-v0.1",
    "dataset_version":  "crossref-verification-v2",
    "state":  "NEEDS_REVIEW",
    "generated_at":  "2026-08-10T06:39:29.2271400Z",
    "request_mode":  "ANONYMOUS_READ_ONLY",
    "user_agent":  "ResearchPilot-Evaluation/0.1 (+https://github.com/DJ1012-H/research-pilot)",
    "selection":  {
                      "provider":  "OpenAlex",
                      "seed":  20260810,
                      "query_url":  "https://api.openalex.org/works?filter=type:article,has_doi:true,is_retracted:false\u0026sample=100\u0026per_page=100\u0026seed=20260810\u0026select=id,doi,title,display_name,publication_year,publication_date,type,language,authorships,primary_location,primary_topic,is_retracted",
                      "snapshot_path":  "eval/crossref-verification-v2/fixtures/intake-v0.1/selection/openalex-sample-seed-20260810.json",
                      "sha256":  "48f0bc23e2e422122e297ec80e6ebbfd188ce3cd8465e039d470fa6716eeed44",
                      "retrieved_at":  "2026-08-10T06:39:01.1292160Z",
                      "requested_sample_size":  100,
                      "returned_count":  100
                  },
    "selection_policy":  {
                             "target_pair_count":  20,
                             "actual_pair_count":  20,
                             "article_only":  true,
                             "doi_required":  true,
                             "retracted_excluded":  true,
                             "unique_primary_source_required":  true,
                             "max_cases_per_primary_topic_field":  3,
                             "crossref_lookup_status_required":  200,
                             "ground_truth_generated":  false
                         },
    "queue":  {
                  "path":  "eval/crossref-verification-v2/draft/review-queue-v0.1.jsonl",
                  "sha256":  "f941163dc85730c1c55cd05c972945aa977aff8f2026be8e7da52c4edc467f93",
                  "case_count":  20,
                  "review_state":  "NEEDS_REVIEW",
                  "expected_labels_present":  false
              },
    "cases":  [
                  {
                      "case_id":  "crv2-case-0001",
                      "doi":  "10.63913/ail.v1i4.44",
                      "openalex_id":  "https://openalex.org/W7123346694",
                      "publication_year":  2025,
                      "language":  null,
                      "primary_source":  {
                                             "id":  "https://openalex.org/S5407049860",
                                             "name":  "Artificial Intelligence in Learning"
                                         },
                      "primary_topic_field":  {
                                                  "id":  "https://openalex.org/fields/33",
                                                  "name":  "Social Sciences"
                                              },
                      "candidate_source":  {
                                               "source_id":  "openalex-W7123346694",
                                               "snapshot_path":  "eval/crossref-verification-v2/fixtures/intake-v0.1/candidate/crv2-case-0001-openalex.json",
                                               "source_url":  "https://api.openalex.org/works/W7123346694?select=id,doi,title,display_name,publication_year,publication_date,type,language,authorships,primary_location,primary_topic,is_retracted",
                                               "retrieved_at":  "2026-08-10T06:39:01.7331014Z",
                                               "sha256":  "d69feef845b26545fef8bff27e44ee5203b2ce623fbf992c075cac7a7dff3819"
                                           },
                      "reference_source":  {
                                               "source_id":  "crossref-doi:10.63913/ail.v1i4.44",
                                               "snapshot_path":  "eval/crossref-verification-v2/fixtures/intake-v0.1/reference/crv2-case-0001-crossref.json",
                                               "source_url":  "https://api.crossref.org/works/10.63913/ail.v1i4.44",
                                               "retrieved_at":  "2026-08-10T06:39:02.8959629Z",
                                               "sha256":  "e0304ecffd39b4985d0dc39c33015ef9275e61008d5c5ead28c4966b2835fe90"
                                           }
                  },
                  {
                      "case_id":  "crv2-case-0002",
                      "doi":  "10.1136/bmj.325.7354.6/a",
                      "openalex_id":  "https://openalex.org/W1980717243",
                      "publication_year":  2002,
                      "language":  "en",
                      "primary_source":  {
                                             "id":  "https://openalex.org/S4393911389",
                                             "name":  "BMJ"
                                         },
                      "primary_topic_field":  {
                                                  "id":  "https://openalex.org/fields/36",
                                                  "name":  "Health Professions"
                                              },
                      "candidate_source":  {
                                               "source_id":  "openalex-W1980717243",
                                               "snapshot_path":  "eval/crossref-verification-v2/fixtures/intake-v0.1/candidate/crv2-case-0002-openalex.json",
                                               "source_url":  "https://api.openalex.org/works/W1980717243?select=id,doi,title,display_name,publication_year,publication_date,type,language,authorships,primary_location,primary_topic,is_retracted",
                                               "retrieved_at":  "2026-08-10T06:39:03.4512591Z",
                                               "sha256":  "6dfc4ee39b604fe9049aad27b0c22cb2d6eb685853196e972b76c405cac65ade"
                                           },
                      "reference_source":  {
                                               "source_id":  "crossref-doi:10.1136/bmj.325.7354.6/a",
                                               "snapshot_path":  "eval/crossref-verification-v2/fixtures/intake-v0.1/reference/crv2-case-0002-crossref.json",
                                               "source_url":  "https://api.crossref.org/works/10.1136/bmj.325.7354.6/a",
                                               "retrieved_at":  "2026-08-10T06:39:04.0886779Z",
                                               "sha256":  "43b6aeb69f461a07987ffb37c4b37baa31e3ca18373034a74de4dd18d06880d5"
                                           }
                  },
                  {
                      "case_id":  "crv2-case-0003",
                      "doi":  "10.1177/030089161109700421",
                      "openalex_id":  "https://openalex.org/W4245282579",
                      "publication_year":  2011,
                      "language":  "en",
                      "primary_source":  {
                                             "id":  "https://openalex.org/S4210189328",
                                             "name":  "Tumori Journal"
                                         },
                      "primary_topic_field":  {
                                                  "id":  "https://openalex.org/fields/27",
                                                  "name":  "Medicine"
                                              },
                      "candidate_source":  {
                                               "source_id":  "openalex-W4245282579",
                                               "snapshot_path":  "eval/crossref-verification-v2/fixtures/intake-v0.1/candidate/crv2-case-0003-openalex.json",
                                               "source_url":  "https://api.openalex.org/works/W4245282579?select=id,doi,title,display_name,publication_year,publication_date,type,language,authorships,primary_location,primary_topic,is_retracted",
                                               "retrieved_at":  "2026-08-10T06:39:04.5851389Z",
                                               "sha256":  "0bcc23d3405efd23a0d61237163fede8fbc2acee14427c319171136c79ac74ce"
                                           },
                      "reference_source":  {
                                               "source_id":  "crossref-doi:10.1177/030089161109700421",
                                               "snapshot_path":  "eval/crossref-verification-v2/fixtures/intake-v0.1/reference/crv2-case-0003-crossref.json",
                                               "source_url":  "https://api.crossref.org/works/10.1177/030089161109700421",
                                               "retrieved_at":  "2026-08-10T06:39:05.2661745Z",
                                               "sha256":  "011a548cac241f0340a12ad1f1b28551c4526de83aa65328b2282015aa707529"
                                           }
                  },
                  {
                      "case_id":  "crv2-case-0004",
                      "doi":  "10.1109/6.925286",
                      "openalex_id":  "https://openalex.org/W2163250436",
                      "publication_year":  2001,
                      "language":  "en",
                      "primary_source":  {
                                             "id":  "https://openalex.org/S66124381",
                                             "name":  "IEEE Spectrum"
                                         },
                      "primary_topic_field":  {
                                                  "id":  "https://openalex.org/fields/14",
                                                  "name":  "Business, Management and Accounting"